<?xml version="1.0" encoding="UTF-8"?>

<!--
    Document   : Observation3.xml
    Created on : 9 dÃ©cembre 2009, 17:26
    Author     : bourgesl
    Description:
        Purpose of the document follows.
-->

<ns0:Observation  xmlns:xsi='http://www.w3.org/2001/XMLSchema-instance'
   xmlns:ns0='http://www.ivoa.net/xml/Observation/Observation.xsd'
   xsi:schemaLocation='http://www.ivoa.net/xml/Observation/Observation.xsd Observation3.xsd' id="" idref="">
  <ns0:Curation id="" idref="">
    <ns0:Publisher name="" ucd=""></ns0:Publisher>
    <ns0:PublisherID></ns0:PublisherID>
    <ns0:Reference name="" ucd=""></ns0:Reference>
    <ns0:Version name="" ucd=""></ns0:Version>
    <ns0:Contact id="" idref="">
      <ns0:Name name="" ucd=""></ns0:Name>
      <ns0:Email name="" ucd=""></ns0:Email>
    </ns0:Contact>
    <ns0:Rights name="" ucd=""></ns0:Rights>
    <ns0:Date name="" ucd=""></ns0:Date>
    <ns0:PublisherDID name="" ucd=""></ns0:PublisherDID>
  </ns0:Curation>
  <ns0:DataID id="" idref="">
    <ns0:Title name="" ucd=""></ns0:Title>
    <ns0:Creator name="" ucd=""></ns0:Creator>
    <ns0:Collection name="" ucd=""></ns0:Collection>
    <ns0:Collection name="" ucd=""></ns0:Collection>
    <ns0:Collection name="" ucd=""></ns0:Collection>
    <ns0:DatasetID></ns0:DatasetID>
    <ns0:Date name="" ucd=""></ns0:Date>
    <ns0:Version name="" ucd=""></ns0:Version>
    <ns0:Instrument name="" ucd=""></ns0:Instrument>
    <ns0:CreationType name="" ucd=""></ns0:CreationType>
    <ns0:Bandpass name="" ucd=""></ns0:Bandpass>
    <ns0:CreatorDID></ns0:CreatorDID>
    <ns0:Contributor name="" ucd=""></ns0:Contributor>
    <ns0:Contributor name="" ucd=""></ns0:Contributor>
    <ns0:Contributor name="" ucd=""></ns0:Contributor>
    <ns0:Logo name="" ucd=""></ns0:Logo>
    <ns0:DataSource name="" ucd=""></ns0:DataSource>
  </ns0:DataID>
  <ns0:Dataset id="" idref="">
    <ns0:ContentType name="" ucd=""></ns0:ContentType>
    <ns0:Length name="" ucd="" unit=""></ns0:Length>
    <ns0:DataModel name="" ucd=""></ns0:DataModel>
  </ns0:Dataset>
  <ns0:Access id="" idref="">
    <ns0:acref name="" ucd=""></ns0:acref>
    <ns0:format name="" ucd=""></ns0:format>
  </ns0:Access>
  <ns0:Provenance id="" idref="">
    <ns0:ObsConfig id="" idref="">
      <ns0:Instrument name="" ucd=""></ns0:Instrument>
      <ns0:Bandpass name="" ucd=""></ns0:Bandpass>
      <ns0:DataSource name="" ucd=""></ns0:DataSource>
    </ns0:ObsConfig>
  </ns0:Provenance>
  <ns0:char></ns0:char>
  <ns0:Mapping id="" idref="">
    <ns0:SpatialAxis id="" idref="">
      <ns0:coordsys></ns0:coordsys>
      <ns0:projection name="" ucd=""></ns0:projection>
      <ns0:Coord name="" ucd=""></ns0:Coord>
      <ns0:crval>
        <ns0:Param name="" ucd=""></ns0:Param>
        <ns0:Param name="" ucd=""></ns0:Param>
        <ns0:Param name="" ucd=""></ns0:Param>
      </ns0:crval>
      <ns0:crpix>
        <ns0:Param name="" ucd=""></ns0:Param>
        <ns0:Param name="" ucd=""></ns0:Param>
        <ns0:Param name="" ucd=""></ns0:Param>
      </ns0:crpix>
      <ns0:cdmatrix>
        <ns0:Param name="" ucd=""></ns0:Param>
        <ns0:Param name="" ucd=""></ns0:Param>
        <ns0:Param name="" ucd=""></ns0:Param>
      </ns0:cdmatrix>
    </ns0:SpatialAxis>
    <ns0:SpectralAxis id="" idref="">
      <ns0:coordsys></ns0:coordsys>
      <ns0:projection name="" ucd=""></ns0:projection>
      <ns0:Coord name="" ucd=""></ns0:Coord>
      <ns0:crval>
        <ns0:Param name="" ucd=""></ns0:Param>
        <ns0:Param name="" ucd=""></ns0:Param>
        <ns0:Param name="" ucd=""></ns0:Param>
      </ns0:crval>
      <ns0:crpix>
        <ns0:Param name="" ucd=""></ns0:Param>
        <ns0:Param name="" ucd=""></ns0:Param>
        <ns0:Param name="" ucd=""></ns0:Param>
      </ns0:crpix>
      <ns0:cdmatrix>
        <ns0:Param name="" ucd=""></ns0:Param>
        <ns0:Param name="" ucd=""></ns0:Param>
        <ns0:Param name="" ucd=""></ns0:Param>
      </ns0:cdmatrix>
    </ns0:SpectralAxis>
    <ns0:TimeAxis id="" idref="">
      <ns0:coordsys></ns0:coordsys>
      <ns0:projection name="" ucd=""></ns0:projection>
      <ns0:Coord name="" ucd=""></ns0:Coord>
      <ns0:crval>
        <ns0:Param name="" ucd=""></ns0:Param>
        <ns0:Param name="" ucd=""></ns0:Param>
        <ns0:Param name="" ucd=""></ns0:Param>
      </ns0:crval>
      <ns0:crpix>
        <ns0:Param name="" ucd=""></ns0:Param>
        <ns0:Param name="" ucd=""></ns0:Param>
        <ns0:Param name="" ucd=""></ns0:Param>
      </ns0:crpix>
      <ns0:cdmatrix>
        <ns0:Param name="" ucd=""></ns0:Param>
        <ns0:Param name="" ucd=""></ns0:Param>
        <ns0:Param name="" ucd=""></ns0:Param>
      </ns0:cdmatrix>
    </ns0:TimeAxis>
    <ns0:AxisMapping id="" idref="">
      <ns0:coordsys></ns0:coordsys>
      <ns0:projection name="" ucd=""></ns0:projection>
      <ns0:Coord name="" ucd=""></ns0:Coord>
      <ns0:crval>
        <ns0:Param name="" ucd=""></ns0:Param>
        <ns0:Param name="" ucd=""></ns0:Param>
        <ns0:Param name="" ucd=""></ns0:Param>
      </ns0:crval>
      <ns0:crpix>
        <ns0:Param name="" ucd=""></ns0:Param>
        <ns0:Param name="" ucd=""></ns0:Param>
        <ns0:Param name="" ucd=""></ns0:Param>
      </ns0:crpix>
      <ns0:cdmatrix>
        <ns0:Param name="" ucd=""></ns0:Param>
        <ns0:Param name="" ucd=""></ns0:Param>
        <ns0:Param name="" ucd=""></ns0:Param>
      </ns0:cdmatrix>
    </ns0:AxisMapping>
    <ns0:AxisMapping id="" idref="">
      <ns0:coordsys></ns0:coordsys>
      <ns0:projection name="" ucd=""></ns0:projection>
      <ns0:Coord name="" ucd=""></ns0:Coord>
      <ns0:crval>
        <ns0:Param name="" ucd=""></ns0:Param>
        <ns0:Param name="" ucd=""></ns0:Param>
        <ns0:Param name="" ucd=""></ns0:Param>
      </ns0:crval>
      <ns0:crpix>
        <ns0:Param name="" ucd=""></ns0:Param>
        <ns0:Param name="" ucd=""></ns0:Param>
        <ns0:Param name="" ucd=""></ns0:Param>
      </ns0:crpix>
      <ns0:cdmatrix>
        <ns0:Param name="" ucd=""></ns0:Param>
        <ns0:Param name="" ucd=""></ns0:Param>
        <ns0:Param name="" ucd=""></ns0:Param>
      </ns0:cdmatrix>
    </ns0:AxisMapping>
    <ns0:AxisMapping id="" idref="">
      <ns0:coordsys></ns0:coordsys>
      <ns0:projection name="" ucd=""></ns0:projection>
      <ns0:Coord name="" ucd=""></ns0:Coord>
      <ns0:crval>
        <ns0:Param name="" ucd=""></ns0:Param>
        <ns0:Param name="" ucd=""></ns0:Param>
        <ns0:Param name="" ucd=""></ns0:Param>
      </ns0:crval>
      <ns0:crpix>
        <ns0:Param name="" ucd=""></ns0:Param>
        <ns0:Param name="" ucd=""></ns0:Param>
        <ns0:Param name="" ucd=""></ns0:Param>
      </ns0:crpix>
      <ns0:cdmatrix>
        <ns0:Param name="" ucd=""></ns0:Param>
        <ns0:Param name="" ucd=""></ns0:Param>
        <ns0:Param name="" ucd=""></ns0:Param>
      </ns0:cdmatrix>
    </ns0:AxisMapping>
  </ns0:Mapping>

</ns0:Observation>
